{
  "schema": "node-ipc-rust-benchmark-v1",
  "schemaVersion": 1,
  "id": "run-20260823T061733086Z-1456d6f26d330552",
  "generatedAt": "2026-08-23T06:17:33.086Z",
  "record": {
    "file": "run-20260823T061733086Z-1456d6f26d330552.json",
    "recordedAt": "2026-08-23T06:23:58.102Z"
  },
  "repository": {
    "capture": "pre-and-post-execution",
    "commit": "2692d32c4d97c94aceedfe6cbdf1a48591ba00b5",
    "dirty": false,
    "changedDuringRun": false,
    "preExecution": {
      "capturedAt": "2026-08-23T06:17:33.084Z",
      "commit": "2692d32c4d97c94aceedfe6cbdf1a48591ba00b5",
      "dirty": false,
      "changedEntries": 0,
      "statusSha256": "e3b0c44298fc1c149afbf4c8996fb92427ae41e4649b934ca495991b7852b855"
    },
    "postExecution": {
      "capturedAt": "2026-08-23T06:23:58.074Z",
      "commit": "2692d32c4d97c94aceedfe6cbdf1a48591ba00b5",
      "dirty": false,
      "changedEntries": 0,
      "statusSha256": "e3b0c44298fc1c149afbf4c8996fb92427ae41e4649b934ca495991b7852b855"
    }
  },
  "system": {
    "platform": "win32",
    "release": "10.0.26100",
    "architecture": "x64",
    "cpu": {
      "model": "AMD EPYC 7763 64-Core Processor",
      "count": 4
    },
    "totalMemoryBytes": 17174360064,
    "machine": {
      "id": "8329547cda518168bc9ce99a9f4b3c08cad62e2d7f7454b31ab3caea1a630b4b"
    },
    "environment": {
      "provider": "github-actions",
      "githubRepository": "RIAEvangelist/node-ipc",
      "imageOS": "win25-vs2026",
      "imageVersion": "20260818.207.1",
      "osLane": "windows-latest",
      "nodeLane": "24.18.1",
      "runId": "32622520570",
      "runAttempt": "1",
      "runnerArchitecture": "X64",
      "runnerEnvironment": "github-hosted",
      "sourceRef": "refs/heads/main",
      "sourceSha": "2692d32c4d97c94aceedfe6cbdf1a48591ba00b5",
      "workflow": "Record Rust and Node TCP benchmark snapshots",
      "workflowRef": "RIAEvangelist/node-ipc/.github/workflows/rust-benchmark.yml@refs/heads/main",
      "workflowSha": "2692d32c4d97c94aceedfe6cbdf1a48591ba00b5"
    }
  },
  "runtime": {
    "node": {
      "version": "v24.18.1",
      "v8": "13.6.233.17-node.50",
      "uv": "1.52.1",
      "openssl": "3.5.7"
    },
    "rust": {
      "version": "rustc 1.85.0 (4d91de4e4 2025-02-17)",
      "release": "1.85.0",
      "host": "x86_64-pc-windows-msvc",
      "commitHash": "4d91de4e48198da2e33413efdcd9cd2cc0c46688",
      "llvmVersion": "19.1.7"
    },
    "cargo": {
      "version": "cargo 1.85.0 (d73d2caf9 2024-12-31)",
      "release": "1.85.0"
    }
  },
  "packages": {
    "npm": {
      "version": "14.0.0",
      "packedBytes": 27069,
      "unpackedBytes": 103527,
      "fileCount": 13,
      "sha1": "5e019d3d6d70037c869504c29c66a721bf553181",
      "integrity": "sha512-lpmngNXWR0uhenh7cdov4lIjPhvgN1T8mHbWD2W78OfiUf6ZEMy9RBNWhF6JfcN/gqHs2wCTCVt87hxOikgbEQ=="
    },
    "crate": {
      "version": "14.0.0",
      "packedBytes": 57626,
      "fileCount": 29,
      "sha256": "92710890b5d502e73091019d5255a212ae7625d4a486d61bd7ae39d8bc530ee6"
    }
  },
  "subjects": {
    "node": {
      "version": "14.0.0",
      "peerSha256": "febe91b7b5017406c4dbb4b9dd7b0f3d82a6418ef0456cea0f92cf3df3d343f2",
      "packageJsonSha256": "0ff9b95b0662d2e619e9aa634567b37b96f6466ecb4060b907c8a876d3a399e0",
      "packageLockSha256": "78e0de5216aeb43c5b5e1fa9b56770455d8a3cdd2dcc72a42c0d9a2163783672"
    },
    "rust": {
      "version": "14.0.0",
      "binarySha256": "0e7d0ec753417f9510fd59c4e72790cb796178b14780414e2e314bc7f0cf312a",
      "cargoTomlSha256": "eb47c4d3b4f0bc6fdc42cc06e8ae325b212b812cd5a7dd99dea8fe3bb892578d",
      "cargoLockSha256": "fbb9818578f56aab0a333833683ea3ea37f35cdb6c13732506f9d3a785a39e38",
      "exampleSha256": "6696168ad46688b72e0a38072e7aeea3350a826cfc6cdb701a5244ccdac0bb2d"
    }
  },
  "config": {
    "mode": "full",
    "warmup": 100000,
    "count": 1000000,
    "payloadBytes": 64,
    "inflight": 64,
    "samplesPerLane": 5,
    "readyTimeoutMs": 15000,
    "sampleTimeoutMs": 180000,
    "cleanupTimeoutMs": 5000,
    "baselineDelayMs": 1000,
    "memoryIntervalMs": 500,
    "lanes": [
      "node-node",
      "node-rust",
      "rust-node",
      "rust-rust"
    ],
    "peerSchema": "node-ipc-roundtrip-v1",
    "transport": "tcp",
    "rustProfile": "release"
  },
  "evidence": {
    "classification": "release-performance-snapshot",
    "performanceClaims": true,
    "publishable": true,
    "rankingEligible": false,
    "certification": false,
    "reasons": [],
    "notes": [
      "hosted and local measurements remain environment-specific"
    ]
  },
  "samples": [
    {
      "orderIndex": 0,
      "round": 0,
      "lane": "node-node",
      "client": "node",
      "server": "node",
      "metrics": {
        "durationNs": "13417980300",
        "roundTripsPerSecond": 74526.86452371674,
        "wireBytes": "276777780",
        "wireBytesPerSecond": 20627380.113235075,
        "latencyNs": {
          "mean": 858459.1948,
          "p50": 867100,
          "p95": 1290800,
          "p99": 1707600,
          "max": 23357500
        }
      },
      "memory": {
        "method": "powershell-workingset",
        "peakKind": "sampled-maximum",
        "intervalMs": 500,
        "clientSampledPeakRssBytes": 99479552,
        "serverSampledPeakRssBytes": 56782848,
        "clientPostExitRssBytes": null,
        "serverPostExitRssBytes": null,
        "clientGoneAfterExit": true,
        "serverGoneAfterExit": true,
        "samplerErrors": 0,
        "parentBeforeGcRssBytes": 45596672,
        "parentAfterGcRssBytes": 45645824,
        "parentPostCleanupRssBytes": 46776320,
        "systemFreeBeforeBytes": 14199672832,
        "systemFreePostCleanupBytes": 14213353472
      },
      "exact": {
        "peerSchema": "node-ipc-roundtrip-v1",
        "host": "loopback-ipv4",
        "portReservationId": "3810d3f81fbf56475b125e9b75b84d346125a1c7abb1f6ea02ae13fdff3bfb57",
        "portReserved": true,
        "reservationReleasedBeforeServer": true,
        "serverListening": true,
        "serverComplete": true,
        "clientComplete": true,
        "serverFrames": 1100000,
        "clientCount": 1000000,
        "payloadBytes": 64,
        "inflight": 64
      },
      "cleanup": {
        "clientNaturalExit": true,
        "serverNaturalExit": true,
        "forced": [],
        "portRebound": true,
        "tempEntriesBeforeRemoval": 0,
        "tempRemoved": true,
        "activeProcesses": 0,
        "activeSockets": 0
      }
    },
    {
      "orderIndex": 1,
      "round": 0,
      "lane": "node-rust",
      "client": "node",
      "server": "rust",
      "metrics": {
        "durationNs": "14877915600",
        "roundTripsPerSecond": 67213.71641602807,
        "wireBytes": "276777780",
        "wireBytesPerSecond": 18603263.215177804,
        "latencyNs": {
          "mean": 951915.3554,
          "p50": 756900,
          "p95": 1851900,
          "p99": 2898200,
          "max": 14906400
        }
      },
      "memory": {
        "method": "powershell-workingset",
        "peakKind": "sampled-maximum",
        "intervalMs": 500,
        "clientSampledPeakRssBytes": 97746944,
        "serverSampledPeakRssBytes": 5128192,
        "clientPostExitRssBytes": null,
        "serverPostExitRssBytes": null,
        "clientGoneAfterExit": true,
        "serverGoneAfterExit": true,
        "samplerErrors": 0,
        "parentBeforeGcRssBytes": 46788608,
        "parentAfterGcRssBytes": 46956544,
        "parentPostCleanupRssBytes": 50778112,
        "systemFreeBeforeBytes": 14199902208,
        "systemFreePostCleanupBytes": 14215475200
      },
      "exact": {
        "peerSchema": "node-ipc-roundtrip-v1",
        "host": "loopback-ipv4",
        "portReservationId": "3bd84bb2a7f56f51a9b8bb9b815abc564aec830547955ff784ad57ae79110cda",
        "portReserved": true,
        "reservationReleasedBeforeServer": true,
        "serverListening": true,
        "serverComplete": true,
        "clientComplete": true,
        "serverFrames": 1100000,
        "clientCount": 1000000,
        "payloadBytes": 64,
        "inflight": 64
      },
      "cleanup": {
        "clientNaturalExit": true,
        "serverNaturalExit": true,
        "forced": [],
        "portRebound": true,
        "tempEntriesBeforeRemoval": 0,
        "tempRemoved": true,
        "activeProcesses": 0,
        "activeSockets": 0
      }
    },
    {
      "orderIndex": 2,
      "round": 0,
      "lane": "rust-node",
      "client": "rust",
      "server": "node",
      "metrics": {
        "durationNs": "20767880800",
        "roundTripsPerSecond": 48151.278,
        "wireBytes": "276777780",
        "wireBytesPerSecond": 13327203.804,
        "latencyNs": {
          "mean": 1328865.996,
          "p50": 1103700,
          "p95": 2865800,
          "p99": 4371500,
          "max": 14077800
        }
      },
      "memory": {
        "method": "powershell-workingset",
        "peakKind": "sampled-maximum",
        "intervalMs": 500,
        "clientSampledPeakRssBytes": 20455424,
        "serverSampledPeakRssBytes": 56131584,
        "clientPostExitRssBytes": null,
        "serverPostExitRssBytes": null,
        "clientGoneAfterExit": true,
        "serverGoneAfterExit": true,
        "samplerErrors": 0,
        "parentBeforeGcRssBytes": 50778112,
        "parentAfterGcRssBytes": 50794496,
        "parentPostCleanupRssBytes": 50737152,
        "systemFreeBeforeBytes": 14208290816,
        "systemFreePostCleanupBytes": 14206488576
      },
      "exact": {
        "peerSchema": "node-ipc-roundtrip-v1",
        "host": "loopback-ipv4",
        "portReservationId": "37169082a20f3522a1edf813855a41cfb674a395f543eed5a17e70da3d88717c",
        "portReserved": true,
        "reservationReleasedBeforeServer": true,
        "serverListening": true,
        "serverComplete": true,
        "clientComplete": true,
        "serverFrames": 1100000,
        "clientCount": 1000000,